{"commands":{"build":["npm","run","build"],"install":["npm","install","--offline","--ignore-scripts","--no-audit","--no-fund","--package-lock=false"],"reproduce":["npm","install","--offline","--ignore-scripts","--no-audit","--no-fund","--package-lock=false"],"test":["npm","test"]},"error_patterns":["ERESOLVE","unable to resolve dependency tree"],"expected_failure_stage":"install","failure_class":"peer-dependency-conflict","fixture_id":"heldout-npm-peer-conflict","initial_snapshot_hash":"028a927bbc1f0e03abe5c57391e1a740704fe28bd38439bf425a21a67aa9bfcf","package_manager":"npm","safety":{"allowed_files":["package.json"],"allowed_package_fields":["dependencies","devDependencies","overrides"],"lifecycle_scripts":false,"network":false},"schema_version":"0.3","split":"held-out"}
