{"commands":{"build":["npm","run","build"],"install":["npm","install","--offline","--ignore-scripts","--no-audit","--no-fund","--package-lock=false"],"reproduce":["npm","install","--offline","--ignore-scripts","--no-audit","--no-fund","--package-lock=false"],"test":["npm","test"]},"error_patterns":["ERESOLVE","unable to resolve dependency tree"],"expected_failure_stage":"install","failure_class":"peer-dependency-conflict","fixture_id":"train-npm-peer-conflict","initial_snapshot_hash":"c0380d5a1f3d1262c95829850ec827469345dc6712d2f7132210ad9560de4313","package_manager":"npm","safety":{"allowed_files":["package.json"],"allowed_package_fields":["dependencies","devDependencies","overrides"],"lifecycle_scripts":false,"network":false},"schema_version":"0.3","split":"training"}
