{"commands":{"build":["npm","run","build"],"install":["npm","install","--offline","--ignore-scripts","--no-audit","--no-fund"],"reproduce":["npm","run","build"],"test":["npm","test"]},"error_patterns":["MODULE_NOT_FOUND","Cannot find module 'ci-builder'"],"expected_failure_stage":"build","failure_class":"missing-build-dev-dependency","fixture_id":"train-npm-missing-dev-dependency","initial_snapshot_hash":"57e272ea78fe88de0b1996670e291172d95ba619b39bba600b206734f150e8b7","package_manager":"npm","safety":{"allowed_files":["package.json","package-lock.json"],"allowed_package_fields":["dependencies","devDependencies"],"lifecycle_scripts":false,"network":false},"schema_version":"0.3","split":"training"}
