{"commands":{"build":["pnpm","run","build"],"install":["pnpm","install","--offline","--frozen-lockfile","--ignore-scripts"],"reproduce":["pnpm","run","build"],"test":["pnpm","test"]},"error_patterns":["MODULE_NOT_FOUND","Cannot find module '@fixture/compiler'"],"expected_failure_stage":"build","failure_class":"missing-build-dev-dependency","fixture_id":"heldout-pnpm-missing-build-dependency","initial_snapshot_hash":"e9510884db4542a0246026564c17bc8db58d792504884c5b2313d200446c751c","package_manager":"pnpm","safety":{"allowed_files":["package.json","pnpm-lock.yaml"],"allowed_package_fields":["dependencies","devDependencies"],"lifecycle_scripts":false,"network":false},"schema_version":"0.3","split":"held-out"}
