{"commands":{"build":["npm","run","build"],"install":["npm","ci","--offline","--ignore-scripts","--no-audit","--no-fund"],"reproduce":["npm","ci","--offline","--ignore-scripts","--no-audit","--no-fund"],"test":["npm","test"]},"error_patterns":["npm ci","package-lock.json","in sync"],"expected_failure_stage":"install","failure_class":"lockfile-manifest-drift","fixture_id":"train-npm-lockfile-drift","initial_snapshot_hash":"3e6a9cf81f6869acc5d5a4d2c34bcb157349c58df5a7b4833ed623cb6fbac801","package_manager":"npm","safety":{"allowed_files":["package.json","package-lock.json"],"allowed_package_fields":["dependencies","devDependencies"],"lifecycle_scripts":false,"network":false},"schema_version":"0.3","split":"training"}
