{"commands":{"build":["pnpm","run","build"],"install":["pnpm","install","--offline","--frozen-lockfile","--ignore-scripts"],"reproduce":["pnpm","install","--offline","--frozen-lockfile","--ignore-scripts"],"test":["pnpm","test"]},"error_patterns":["ERR_PNPM_OUTDATED_LOCKFILE","frozen-lockfile"],"expected_failure_stage":"install","failure_class":"frozen-lockfile-drift","fixture_id":"heldout-pnpm-frozen-lockfile","initial_snapshot_hash":"30af59fdd8f3d3f0a1676caef057e5ee3a43ffe02129a9806903297eb416094b","package_manager":"pnpm","safety":{"allowed_files":["package.json","pnpm-lock.yaml"],"allowed_package_fields":["dependencies","devDependencies"],"lifecycle_scripts":false,"network":false},"schema_version":"0.3","split":"held-out"}
